{
  "schema_version": 1,
  "script_id": "bogroot_hm_v1",
  "bot": "FroggyHM",
  "mode": "hard_mode",
  "maps": {
    "gadds": {"map_id": 638, "name": "Gadd's Encampment"},
    "sparkfly": {"map_id": 558, "name": "Sparkfly Swamp"},
    "bogroot_l1": {"map_id": 615, "name": "Bogroot Growths L1"},
    "bogroot_l2": {"map_id": 616, "name": "Bogroot Growths L2"}
  },
  "steps": [
    {
      "id": "town_setup_gadds",
      "map_id": 638,
      "kind": "town_setup",
      "label": "Gadd's Encampment setup",
      "x": 0,
      "y": 0,
      "tolerance": 0,
      "phase": "town",
      "order": 0,
      "source": "FroggyHM town setup"
    },
    {
      "id": "travel_sparkfly",
      "map_id": 638,
      "kind": "travel",
      "label": "Travel to Sparkfly Swamp",
      "x": 0,
      "y": 0,
      "tolerance": 0,
      "phase": "town",
      "order": 1,
      "to_map_id": 558,
      "source": "FroggyHM HandleTravel"
    },
    {"id": "sparkfly_1", "map_id": 558, "kind": "route", "label": "Sparkfly 1", "x": -4559, "y": -14406, "tolerance": 650, "phase": "sparkfly_to_tekks", "order": 2, "source": "FroggyHM SPARKFLY_TO_DUNGEON"},
    {"id": "sparkfly_2", "map_id": 558, "kind": "route", "label": "Sparkfly 2", "x": -5204, "y": -9831, "tolerance": 650, "phase": "sparkfly_to_tekks", "order": 3, "source": "FroggyHM SPARKFLY_TO_DUNGEON"},
    {"id": "sparkfly_3", "map_id": 558, "kind": "route", "label": "Sparkfly 3", "x": -928, "y": -8699, "tolerance": 650, "phase": "sparkfly_to_tekks", "order": 4, "source": "FroggyHM SPARKFLY_TO_DUNGEON"},
    {"id": "sparkfly_4", "map_id": 558, "kind": "route", "label": "Sparkfly 4", "x": 4200, "y": -4897, "tolerance": 650, "phase": "sparkfly_to_tekks", "order": 5, "source": "FroggyHM SPARKFLY_TO_DUNGEON"},
    {"id": "sparkfly_5", "map_id": 558, "kind": "route", "label": "Sparkfly 5", "x": 6114, "y": 819, "tolerance": 650, "phase": "sparkfly_to_tekks", "order": 6, "source": "FroggyHM SPARKFLY_TO_DUNGEON"},
    {"id": "sparkfly_6", "map_id": 558, "kind": "route", "label": "Sparkfly 6", "x": 9500, "y": 2281, "tolerance": 650, "phase": "sparkfly_to_tekks", "order": 7, "source": "FroggyHM SPARKFLY_TO_DUNGEON"},
    {"id": "sparkfly_7", "map_id": 558, "kind": "route", "label": "Sparkfly 7", "x": 11570, "y": 6120, "tolerance": 650, "phase": "sparkfly_to_tekks", "order": 8, "source": "FroggyHM SPARKFLY_TO_DUNGEON"},
    {"id": "sparkfly_8", "map_id": 558, "kind": "route", "label": "Sparkfly 8", "x": 11025, "y": 11710, "tolerance": 650, "phase": "sparkfly_to_tekks", "order": 9, "source": "FroggyHM SPARKFLY_TO_DUNGEON"},
    {"id": "sparkfly_9", "map_id": 558, "kind": "route", "label": "Sparkfly 9", "x": 14624, "y": 19314, "tolerance": 650, "phase": "sparkfly_to_tekks", "order": 10, "source": "FroggyHM SPARKFLY_TO_DUNGEON"},
    {"id": "tekks_accept", "map_id": 558, "kind": "quest_accept", "label": "Tekks quest accept", "x": 12396, "y": 22407, "tolerance": 850, "phase": "tekks", "order": 11, "dialog_id": 8608001, "source": "bridge/dungeon_runs.py"},
    {"id": "bogroot_entry", "map_id": 558, "kind": "dungeon_entry", "label": "Bogroot entrance", "x": 12968, "y": 26219, "tolerance": 900, "phase": "dungeon_entry", "order": 12, "to_map_id": 615, "source": "FroggyHM PrepareTekksDungeonEntry"},
    {"id": "l1_spawn", "map_id": 615, "kind": "spawn", "label": "L1 spawn", "x": 17026, "y": 2168, "tolerance": 650, "phase": "bogroot_l1", "order": 13, "source": "bridge/dungeon_runs.py"},
    {"id": "l1_blessing", "map_id": 615, "kind": "blessing", "label": "Dwarven blessing", "x": 19099, "y": 7762, "tolerance": 800, "phase": "bogroot_l1", "order": 14, "source": "bridge/dungeon_runs.py"},
    {"id": "l1_quest_door_checkpoint", "map_id": 615, "kind": "checkpoint", "label": "Quest Door Checkpoint", "x": 14434, "y": 8000, "tolerance": 800, "phase": "bogroot_l1", "order": 15, "source": "bridge/dungeon_runs.py"},
    {"id": "l1_mid_convergence", "map_id": 615, "kind": "checkpoint", "label": "mid convergence", "x": 672, "y": 1105, "tolerance": 900, "phase": "bogroot_l1", "order": 16, "source": "bridge/dungeon_runs.py"},
    {"id": "l1_to_l2", "map_id": 615, "kind": "portal", "label": "Lvl1 to Lvl2", "x": 7665, "y": -19050, "tolerance": 900, "phase": "bogroot_l1", "order": 17, "to_map_id": 616, "source": "bridge/dungeon_runs.py"},
    {"id": "l2_spawn", "map_id": 616, "kind": "spawn", "label": "L2 spawn", "x": -11386, "y": -3871, "tolerance": 700, "phase": "bogroot_l2", "order": 18, "source": "bridge/dungeon_runs.py"},
    {"id": "l2_route_4", "map_id": 616, "kind": "checkpoint", "label": "L2 route 4", "x": -4110, "y": 4484, "tolerance": 900, "phase": "bogroot_l2", "order": 19, "source": "FroggyHM BOGROOT_LVL2"},
    {"id": "l2_route_12", "map_id": 616, "kind": "checkpoint", "label": "L2 route 12", "x": 3086, "y": 12899, "tolerance": 1000, "phase": "bogroot_l2", "order": 20, "source": "FroggyHM BOGROOT_LVL2"},
    {"id": "l2_route_18", "map_id": 616, "kind": "checkpoint", "label": "L2 route 18", "x": 12200, "y": -6591, "tolerance": 1000, "phase": "bogroot_l2", "order": 21, "source": "FroggyHM BOGROOT_LVL2"},
    {"id": "l2_dungeon_key", "map_id": 616, "kind": "key", "label": "Dungeon Key", "x": 16854, "y": -5830, "tolerance": 700, "phase": "bogroot_l2", "order": 22, "source": "bridge/dungeon_runs.py"},
    {"id": "l2_dungeon_door", "map_id": 616, "kind": "door", "label": "Dungeon Door", "x": 17925, "y": -6197, "tolerance": 700, "phase": "bogroot_l2", "order": 23, "source": "bridge/dungeon_runs.py"},
    {"id": "l2_boss_gauntlet_start", "map_id": 616, "kind": "boss_engagement", "label": "boss gauntlet start", "x": 18334, "y": -8838, "tolerance": 1000, "phase": "bogroot_l2", "order": 24, "source": "FroggyHM BOGROOT_LVL2"},
    {"id": "l2_final_boss_approach", "map_id": 616, "kind": "checkpoint", "label": "final boss approach", "x": 14035, "y": -17800, "tolerance": 1000, "phase": "bogroot_l2", "order": 25, "source": "bridge/dungeon_runs.py"},
    {"id": "l2_end_chest", "map_id": 616, "kind": "end_chest", "label": "Bogroot end chest", "x": 14876, "y": -19033, "tolerance": 900, "phase": "bogroot_l2", "order": 26, "source": "bridge/dungeon_runs.py"},
    {"id": "tekks_reward", "map_id": 558, "kind": "reward_turnin", "label": "Tekks reward turn-in", "x": 12396, "y": 22407, "tolerance": 850, "phase": "tekks_reward", "order": 27, "dialog_id": 8608007, "source": "bridge/dungeon_runs.py"},
    {"id": "merchant_cycle", "map_id": 638, "kind": "merchant_cycle", "label": "Sell, trade, salvage, restart", "x": 0, "y": 0, "tolerance": 0, "phase": "maintenance", "order": 28, "source": "FroggyHM MaintenanceMgr"}
  ]
}
